{
  "profile": "mission",
  "kind": "mission_status",
  "mission_id": "2026-07-04_010203_weather",
  "state": "partial",
  "terminal": true,
  "partial_failures": 1,
  "cancelled": false,
  "parent_invocation_id": null,
  "parent_receipt_ura": "easynet:///r/example/receipt/parent",
  "parent_invocation": {
    "caller": "easynet:///r/example/agent/alice.sdk",
    "callee": "easynet:///r/example/device/dev-a",
    "ability": "mission.run",
    "subject": "easynet:///r/example/device/dev-a",
    "causal_context": {
      "form": "scalar",
      "receipt_ura": "easynet:///r/example/receipt/parent",
      "receipt_hash_hex": "aaaaaaaaaaaaaaaaaaaaaaaaaaaaaaaaaaaaaaaaaaaaaaaaaaaaaaaaaaaaaaaa"
    }
  },
  "child_invocations": [
    {
      "step_id": "s1",
      "request_id": "req-1",
      "trace_id": "2026-07-04_010203_weather",
      "ability": "observe.health",
      "invocation_ura": "easynet:///r/example/invocation/req-1",
      "caller_ura": "easynet:///r/example/device/dev-a",
      "callee_ura": "easynet:///r/example/device/dev-a",
      "subject_ura": "easynet:///r/example/device/dev-a",
      "metadata_state": "receipt_backed",
      "ledger_state": "completed",
      "receipt": {
        "receipt_ura": "easynet:///r/example/receipt/child",
        "receipt_hash": "bbbb",
        "head_receipt_hash": "bbbb"
      }
    }
  ],
  "child_receipts": [
    {
      "step_id": "s1",
      "invocation_ura": "easynet:///r/example/invocation/req-1",
      "receipt_ura": "easynet:///r/example/receipt/child",
      "receipt_hash": "bbbb"
    }
  ],
  "output_refs": [
    {
      "kind": "run_dir",
      "path": "/tmp/easynet/missions/runs/2026-07-04_010203_weather"
    },
    {
      "kind": "mission_meta",
      "path": "/tmp/easynet/missions/runs/2026-07-04_010203_weather/meta.json"
    },
    {
      "kind": "mission_trace",
      "path": "/tmp/easynet/missions/runs/2026-07-04_010203_weather/trace.json"
    },
    {
      "kind": "mission_source",
      "path": "/tmp/easynet/missions/runs/2026-07-04_010203_weather/source.eal"
    }
  ],
  "metadata": {
    "profile": "mission",
    "carrier_owner": "daemon_sdk",
    "status_source": "mission_result",
    "running": false,
    "name": "weather",
    "trace_id": "2026-07-04_010203_weather",
    "steps_total": 2,
    "steps_completed": 1,
    "steps_failed": 1
  }
}
